사용자,날짜/시간,화자,메시지,AI 피드백
"김세진 (김세진)","2025. 9. 18. 오후 12:40:37","학생","선생님, 이거 '또는'이에요? '그리고'에요?","### 피드백 분석

| TMSSR Framework 요소 | 교사의 발화 및 상호작용 | 학생의 수학적 사고에 미치는 영향 | 개선 제안 |
|----------------------|--------------------------|---------------------------------|----------|
| **이끌기 (Eliciting)** | 교사는 학생에게 '또는'과 '그리고'의 차이를 묻고, 학생의 이해를 확인하려고 함. | 학생의 기본적인 이해를 진단하고, 사고의 출발점을 제공함. | 학생의 초기 아이디어를 더 깊이 탐구할 수 있는 추가 질문을 제시하여 사고를 확장할 수 있도록 유도할 수 있음. |
| **응답하기 (Responding)** | 학생의 설명에 대해 교사는 추가적인 질문을 통해 명료화를 유도함. | 학생의 사고를 명확히 하고, 스스로 오류를 수정할 기회를 제공함. | 학생의 발화를 재음성화하거나, 학생이 스스로 자신의 설명을 재구성하도록 유도할 수 있음. |
| **촉진하기 (Facilitating)** | 교사는 대우에 관한 교과서 부분을 읽어보도록 제안함. | 학생이 스스로 개념을 탐구하고 이해를 심화할 수 있도록 지원함. | 개념적 힌트나 구조를 제공하여 학생이 더 깊이 있는 이해를 할 수 있도록 돕는 것이 필요함. |
| **확장하기 (Extending)** | 교사는 학생에게 추가적인 자료를 통해 사고를 확장할 기회를 제공함. | 학생이 자신의 이해를 정당화하고 일반화할 수 있는 기회를 제공함. | 학생이 자신의 이해를 반성하고, 다른 상황에 적용할 수 있는 일반화 능력을 키울 수 있도록 추가적인 질문을 제시할 수 있음. |

### 종합 평가 및 제안

교사의 발화는 학생의 초기 이해를 확인하고, 스스로 사고를 확장할 수 있는 기회를 제공하는 데 효과적이었습니다. 그러나 학생의 사고를 더 깊이 탐구하고 확장할 수 있는 추가적인 질문과 피드백이 필요합니다. TMSSR Framework에 따라, 교사는 학생의 발화를 재구성하거나, 개념적 힌트를 제공하여 학생이 더 깊이 있는 이해를 할 수 있도록 지원해야 합니다."
"김세진 (김세진)","2025. 9. 18. 오후 12:40:37","교사","'또는'이랑 '그리고'는 어떤 차이가 있는데?",""
"김세진 (김세진)","2025. 9. 18. 오후 12:40:37","학생","위 명제에서 '또는'은 a,b 둘 중 적어도 하나는 0이여 한다에요.",""
"김세진 (김세진)","2025. 9. 18. 오후 12:40:37","교사","'그리고'는?",""
"김세진 (김세진)","2025. 9. 18. 오후 12:40:37","학생","'그리고'는 a,b 두개 모두 다 0이여한다에요.",""
"김세진 (김세진)","2025. 9. 18. 오후 12:40:37","교사","그러면 교과서 앞쪽 부분에 있는 대우에 관해서 읽어보고 다시 한번 생각해볼래?",""
"김세진 (김세진)","2025. 9. 18. 오후 12:40:37","학생","넵!",""
